{
  "schema_version": "1.0.0",
  "workflow_step": "building_identity_confirmation",
  "user_intake": {
    "raw_user_request": "im looking for kcc",
    "known_name_or_description": "kcc",
    "known_location": {
      "city": null,
      "province_or_region": null,
      "address_text": null,
      "nearby_landmarks": []
    },
    "provided_links": [],
    "provided_media_or_documents": []
  },
  "identity_candidates": [
    {
      "candidate_id": "fixture-kcc-malls-brand",
      "display_name": "KCC Malls",
      "aliases": ["KCC", "KCC Mall", "Koronadal Commercial Center"],
      "entity_type": "mall",
      "building_scope": "building_complex_or_campus",
      "address": {
        "full_address": null,
        "barangay": null,
        "city": null,
        "province_or_region": "Mindanao",
        "country": "Philippines"
      },
      "coordinates": {
        "latitude": null,
        "longitude": null,
        "source": null
      },
      "jurisdiction": {
        "lgu": null,
        "likely_obo_or_building_office": null
      },
      "known_operator_or_brand": "KCC Malls",
      "known_owner_or_developer": null,
      "identity_confidence": "medium",
      "why_this_candidate": ["KCC is a known Philippine mall brand with multiple branches."],
      "why_it_might_not_be_this": ["The user did not say mall, branch, city, or province."],
      "evidence": [
        {
          "claim": "Fixture identity lookup treats KCC as a possible mall brand.",
          "source": {
            "url": "https://example.com/fixtures/kcc-malls",
            "label": "Gate 1 fixture source",
            "source_type": "other"
          },
          "notes": "Test fixture only; not live public evidence."
        }
      ],
      "ambiguities": ["KCC has multiple mall branches and may not be the intended expansion."]
    },
    {
      "candidate_id": "fixture-korean-cultural-center-taguig",
      "display_name": "Korean Cultural Center in the Philippines",
      "aliases": ["KCC Philippines", "Korean Cultural Center"],
      "entity_type": "public_facility",
      "building_scope": "whole_building",
      "address": {
        "full_address": "Fixture Bayani Road, Taguig City",
        "barangay": null,
        "city": "Taguig",
        "province_or_region": "Metro Manila",
        "country": "Philippines"
      },
      "coordinates": {
        "latitude": null,
        "longitude": null,
        "source": null
      },
      "jurisdiction": {
        "lgu": "Taguig City",
        "likely_obo_or_building_office": "Taguig City Local Building Office"
      },
      "known_operator_or_brand": "Korean Cultural Center",
      "known_owner_or_developer": null,
      "identity_confidence": "medium",
      "why_this_candidate": ["KCC can also abbreviate Korean Cultural Center in the Philippines."],
      "why_it_might_not_be_this": ["The user did not mention Taguig, Korea, culture, or an event venue."],
      "evidence": [
        {
          "claim": "Fixture identity lookup treats KCC as a possible cultural center abbreviation.",
          "source": {
            "url": "https://example.com/fixtures/korean-cultural-center",
            "label": "Gate 1 fixture source",
            "source_type": "other"
          },
          "notes": "Test fixture only; not live public evidence."
        }
      ],
      "ambiguities": ["KCC is an abbreviation with more than one plausible meaning."]
    }
  ],
  "selected_candidate": {
    "candidate_id": "fixture-kcc-malls-brand",
    "display_name": "KCC Malls",
    "aliases": ["KCC", "KCC Mall", "Koronadal Commercial Center"],
    "entity_type": "mall",
    "building_scope": "building_complex_or_campus",
    "address": {
      "full_address": null,
      "barangay": null,
      "city": null,
      "province_or_region": "Mindanao",
      "country": "Philippines"
    },
    "coordinates": {
      "latitude": null,
      "longitude": null,
      "source": null
    },
    "jurisdiction": {
      "lgu": null,
      "likely_obo_or_building_office": null
    },
    "known_operator_or_brand": "KCC Malls",
    "known_owner_or_developer": null,
    "identity_confidence": "medium",
    "why_this_candidate": ["KCC is a known Philippine mall brand with multiple branches."],
    "why_it_might_not_be_this": ["The user did not say mall, branch, city, or province."],
    "evidence": [
      {
        "claim": "Fixture identity lookup treats KCC as a possible mall brand.",
        "source": {
          "url": "https://example.com/fixtures/kcc-malls",
          "label": "Gate 1 fixture source",
          "source_type": "other"
        },
        "notes": "Test fixture only; not live public evidence."
      }
    ],
    "ambiguities": ["KCC has multiple mall branches and may not be the intended expansion."]
  },
  "confirmation": {
    "status": "candidate_ready_for_user_confirmation",
    "user_facing_confirmation_prompt": "KCC is ambiguous. Do you mean KCC Malls, or the Korean Cultural Center in Taguig?",
    "clarification_style": "top_three_options",
    "clarifying_questions": ["Do you mean KCC Malls, or the Korean Cultural Center in Taguig?"],
    "can_proceed_to_audit": false,
    "blockers": ["multiple_similar_candidates", "waiting_for_user_confirmation"]
  }
}
